# mysql -u profesor -p
Enter password: *********
Welcome to the MariaDB monitor.  Commands end with ; or \g.
Your MariaDB connection id is 8037
Server version: 10.4.32-MariaDB mariadb.org binary distribution

Copyright (c) 2000, 2018, Oracle, MariaDB Corporation Ab and others.

Type 'help;' or '\h' for help. Type '\c' to clear the current input statement.

MariaDB [(none)]>


Setting environment for using XAMPP for Windows.
PROFESOR@WIN-CMUODTI144V c:\xampp
# mysql -u root -p
Enter password:
Welcome to the MariaDB monitor.  Commands end with ; or \g.
Your MariaDB connection id is 7617
Server version: 10.4.32-MariaDB mariadb.org binary distribution

Copyright (c) 2000, 2018, Oracle, MariaDB Corporation Ab and others.

Type 'help;' or '\h' for help. Type '\c' to clear the current input statement.

MariaDB [(none)]> use db_profesor;
Database changed
MariaDB [db_profesor]> CREATE FUNCTION `cuadrado`(`arg_valor` INT) RETURNS INT NOT DETERMINISTIC CONTAINS SQL SQL SECURITY DEFINER RETURN arg_valor*arg_valor;
Query OK, 0 rows affected (0.003 sec)

MariaDB [db_profesor]> SELECT CUADRADO(9);
+-------------+
| CUADRADO(9) |
+-------------+
|          81 |
+-------------+
1 row in set (0.000 sec)

MariaDB [db_profesor]> SET @p0='9';
Query OK, 0 rows affected (0.001 sec)

MariaDB [db_profesor]> SELECT `cuadrado`(@p0) AS `cuadrado`;
+----------+
| cuadrado |
+----------+
|       81 |
+----------+
1 row in set (0.000 sec)

MariaDB [db_profesor]> SET @p0='COCINA';
Query OK, 0 rows affected (0.000 sec)

MariaDB [db_profesor]> CALL `consulta`(@p0);
ERROR 1305 (42000): PROCEDURE db_profesor.consulta does not exist
MariaDB [db_profesor]> CREATE DEFINER=`root`@`localhost` PROCEDURE `consulta`(IN `arg_producto` TEXT) NOT DETERMINISTIC CONTAINS SQL SQL SECURITY DEFINER SELECT * FROM PRODUCTOS WHERE nombre = arg_producto
    -> ;
Query OK, 0 rows affected (0.008 sec)

MariaDB [db_profesor]> CALL consulta('NEVERA');
+----+--------------+--------+----------+--------+
| id | proveedor_id | nombre | cantidad | precio |
+----+--------------+--------+----------+--------+
|  1 |            1 | NEVERA |        6 | 500.25 |
+----+--------------+--------+----------+--------+
1 row in set (0.001 sec)

Query OK, 0 rows affected (0.004 sec)

MariaDB [db_profesor]>
MariaDB [db_profesor]>
MariaDB [db_profesor]> CREATE USER 'profesor'@'localhost' IDENTIFIED VIA mysql_native_password USING '***';
ERROR 1396 (HY000): Operation CREATE USER failed for 'profesor'@'localhost'
MariaDB [db_profesor]>
MariaDB [db_profesor]>
MariaDB [db_profesor]> SELECT * FROM USERS;
ERROR 1146 (42S02): Table 'db_profesor.users' doesn't exist
MariaDB [db_profesor]> exit
Bye

PROFESOR@WIN-CMUODTI144V c:\xampp
#
PROFESOR@WIN-CMUODTI144V c:\xampp
#
PROFESOR@WIN-CMUODTI144V c:\xampp
#
PROFESOR@WIN-CMUODTI144V c:\xampp
#
PROFESOR@WIN-CMUODTI144V c:\xampp
#
PROFESOR@WIN-CMUODTI144V c:\xampp
#
PROFESOR@WIN-CMUODTI144V c:\xampp
#
PROFESOR@WIN-CMUODTI144V c:\xampp
#
PROFESOR@WIN-CMUODTI144V c:\xampp
#
PROFESOR@WIN-CMUODTI144V c:\xampp
#
PROFESOR@WIN-CMUODTI144V c:\xampp
# mysql -u profesor -p
Enter password: *********
Welcome to the MariaDB monitor.  Commands end with ; or \g.
Your MariaDB connection id is 8037
Server version: 10.4.32-MariaDB mariadb.org binary distribution

Copyright (c) 2000, 2018, Oracle, MariaDB Corporation Ab and others.

Type 'help;' or '\h' for help. Type '\c' to clear the current input statement.

MariaDB [(none)]> use db_profesor;
Database changed
MariaDB [db_profesor]> show tables;
+----------------------------------------+
| Tables_in_db_profesor                  |
+----------------------------------------+
| asignaturas                            |
| estudiantes                            |
| estudiantes_asignaturas                |
| personas                               |
| personas1                              |
| personas_con_indice                    |
| personas_con_indice_cedula             |
| personas_con_indice_cedula_correo      |
| productos                              |
| productos_cascade                      |
| productos_secuencial                   |
| productos_varios                       |
| proveedores                            |
| proveedores_cascade                    |
| proveedores_secuencial                 |
| vista_estudiantes_asignaturas          |
| vista_full_join_proveedores_productos  |
| vista_inner_join_proveedores_productos |
| vista_left_join_proveedores_productos  |
| vista_right_join_proveedores_productos |
+----------------------------------------+
20 rows in set (0.000 sec)

MariaDB [db_profesor]> select * from personas;
+--------+---------+-----------+--------------+--------------+------------+---------------------+------+
| cedula | nombre  | apellido  | direccion    | email        | telefono   | fecha_de_nacimiento | edad |
+--------+---------+-----------+--------------+--------------+------------+---------------------+------+
| V1234  | ANA     | VASQUEZ   | SANTA FE     | av@gmail.com | 2124445566 | 1960-08-15          |   66 |
| V5678  | YOLANDA | TORTOZA   | CATIA LA MAR | yt@gmail.com | 2123334455 | 1975-09-10          |   51 |
| V9012  | NELLY   | CONTRERAS | LA VEGA      | nc@gmail.com | 2124434930 | 1968-07-16          |   58 |
| V3456  | LIBIA   | COLS      | GUARENAS     | lc@gmail.com | 2123634106 | 1975-05-20          |   51 |
+--------+---------+-----------+--------------+--------------+------------+---------------------+------+
4 rows in set (0.001 sec)

MariaDB [db_profesor]>
MariaDB [db_profesor]> INSERT INTO personas(cedula, nombre, apellido,
    -> direccion, email, telefono, fecha_de_nacimiento,
    -> edad) VALUES
    -> ('V1234','ANA','VASQUEZ','SANTA FE', 'av@gmail.com',
    -> '2124445566','1960-08-15', 66);
ERROR 1142 (42000): INSERT command denied to user 'profesor'@'localhost' for table `db_profesor`.`personas`
MariaDB [db_profesor]> DELETE FROM personas WHERE cedula = 'V1234';
ERROR 1142 (42000): DELETE command denied to user 'profesor'@'localhost' for table `db_profesor`.`personas`
MariaDB [db_profesor]> UPDATE personas SET nombre = 'ANA MARIA'
    -> WHERE cedula = 'V1234';
ERROR 1142 (42000): UPDATE command denied to user 'profesor'@'localhost' for table `db_profesor`.`personas`
MariaDB [db_profesor]> select * from mysql.user;
+-----------+------------------+-------------------------------------------+-------------+-------------+-------------+-------------+-------------+-----------+-------------+---------------+--------------+-----------+------------+-----------------+------------+------------+--------------+------------+-----------------------+------------------+--------------+-----------------+------------------+------------------+----------------+---------------------+--------------------+------------------+------------+--------------+------------------------+---------------------+----------+------------+-------------+--------------+---------------+-------------+-----------------+----------------------+-----------------------+-------------------------------------------+------------------+---------+--------------+--------------------+
| Host      | User             | Password                                  | Select_priv | Insert_priv | Update_priv | Delete_priv | Create_priv | Drop_priv | Reload_priv | Shutdown_priv | Process_priv | File_priv | Grant_priv | References_priv | Index_priv | Alter_priv | Show_db_priv | Super_priv | Create_tmp_table_priv | Lock_tables_priv | Execute_priv | Repl_slave_priv | Repl_client_priv | Create_view_priv | Show_view_priv | Create_routine_priv | Alter_routine_priv | Create_user_priv | Event_priv | Trigger_priv | Create_tablespace_priv | Delete_history_priv | ssl_type | ssl_cipher | x509_issuer | x509_subject | max_questions | max_updates | max_connections | max_user_connections | plugin                | authentication_string                     | password_expired | is_role | default_role | max_statement_time |
+-----------+------------------+-------------------------------------------+-------------+-------------+-------------+-------------+-------------+-----------+-------------+---------------+--------------+-----------+------------+-----------------+------------+------------+--------------+------------+-----------------------+------------------+--------------+-----------------+------------------+------------------+----------------+---------------------+--------------------+------------------+------------+--------------+------------------------+---------------------+----------+------------+-------------+--------------+---------------+-------------+-----------------+----------------------+-----------------------+-------------------------------------------+------------------+---------+--------------+--------------------+
| localhost | root             |                                           | Y           | Y           | Y           | Y           | Y           | Y         | Y           | Y             | Y            | Y         | Y          | Y               | Y          | Y          | Y            | Y          | Y                     | Y                | Y            | Y               | Y                | Y                | Y              | Y                   | Y                  | Y                | Y          | Y            | Y                      | Y                   |          |            |             |              |             0 |           0 |               0 |                    0 |                       |                                           | N                | N       |              |           0.000000 |
| %         | prueba_admin     | *84AAC12F54AB666ECFC2A83C676908C8BBC381B1 | N           | N           | N           | N           | N           | N         | N           | N             | N            | N         | N          | N               | N          | N          | N            | N          | N                     | N                | N            | N               | N                | N                | N              | N                   | N                  | N                | N          | N            | N                      | N                   |          |            |             |              |             0 |           0 |               0 |                    0 | mysql_native_password | *84AAC12F54AB666ECFC2A83C676908C8BBC381B1 | N                | N       |              |           0.000000 |
| 127.0.0.1 | root             |                                           | Y           | Y           | Y           | Y           | Y           | Y         | Y           | Y             | Y            | Y         | Y          | Y               | Y          | Y          | Y            | Y          | Y                     | Y                | Y            | Y               | Y                | Y                | Y              | Y                   | Y                  | Y                | Y          | Y            | Y                      | Y                   |          |            |             |              |             0 |           0 |               0 |                    0 |                       |                                           | N                | N       |              |           0.000000 |
| ::1       | root             |                                           | Y           | Y           | Y           | Y           | Y           | Y         | Y           | Y             | Y            | Y         | Y          | Y               | Y          | Y          | Y            | Y          | Y                     | Y                | Y            | Y               | Y                | Y                | Y              | Y                   | Y                  | Y                | Y          | Y            | Y                      | Y                   |          |            |             |              |             0 |           0 |               0 |                    0 |                       |                                           | N                | N       |              |           0.000000 |
| localhost | pma              |                                           | N           | N           | N           | N           | N           | N         | N           | N             | N            | N         | N          | N               | N          | N          | N            | N          | N                     | N                | N            | N               | N                | N                | N              | N                   | N                  | N                | N          | N            | N                      | N                   |          |            |             |              |             0 |           0 |               0 |                    0 | mysql_native_password |                                           | N                | N       |              |           0.000000 |
| %         | prueba_user      | *6BB4837EB74329105EE4568DDA7DC67ED2CA2AD9 | N           | N           | N           | N           | N           | N         | N           | N             | N            | N         | N          | N               | N          | N          | N            | N          | N                     | N                | N            | N               | N                | N                | N              | N                   | N                  | N                | N          | N            | N                      | N                   |          |            |             |              |             0 |           0 |               0 |                    0 | mysql_native_password | *6BB4837EB74329105EE4568DDA7DC67ED2CA2AD9 | N                | N       |              |           0.000000 |
| %         | prueba_invitado  | *A4B6157319038724E3560894F7F932C8886EBFCF | N           | N           | N           | N           | N           | N         | N           | N             | N            | N         | N          | N               | N          | N          | N            | N          | N                     | N                | N            | N               | N                | N                | N              | N                   | N                  | N                | N          | N            | N                      | N                   |          |            |             |              |             0 |           0 |               0 |                    0 | mysql_native_password | *A4B6157319038724E3560894F7F932C8886EBFCF | N                | N       |              |           0.000000 |
| %         | prueba_admin7    | *84AAC12F54AB666ECFC2A83C676908C8BBC381B1 | N           | N           | N           | N           | N           | N         | N           | N             | N            | N         | N          | N               | N          | N          | N            | N          | N                     | N                | N            | N               | N                | N                | N              | N                   | N                  | N                | N          | N            | N                      | N                   |          |            |             |              |             0 |           0 |               0 |                    0 | mysql_native_password | *84AAC12F54AB666ECFC2A83C676908C8BBC381B1 | N                | N       |              |           0.000000 |
| %         | prueba_user7     | *6BB4837EB74329105EE4568DDA7DC67ED2CA2AD9 | N           | N           | N           | N           | N           | N         | N           | N             | N            | N         | N          | N               | N          | N          | N            | N          | N                     | N                | N            | N               | N                | N                | N              | N                   | N                  | N                | N          | N            | N                      | N                   |          |            |             |              |             0 |           0 |               0 |                    0 | mysql_native_password | *6BB4837EB74329105EE4568DDA7DC67ED2CA2AD9 | N                | N       |              |           0.000000 |
| %         | prueba_invitado7 | *A4B6157319038724E3560894F7F932C8886EBFCF | N           | N           | N           | N           | N           | N         | N           | N             | N            | N         | N          | N               | N          | N          | N            | N          | N                     | N                | N            | N               | N                | N                | N              | N                   | N                  | N                | N          | N            | N                      | N                   |          |            |             |              |             0 |           0 |               0 |                    0 | mysql_native_password | *A4B6157319038724E3560894F7F932C8886EBFCF | N                | N       |              |           0.000000 |
| %         | maximo           | *E93577222CEFB0AD211863274B5845E1C8EA8968 | N           | N           | N           | N           | N           | N         | N           | N             | N            | N         | N          | N               | N          | N          | N            | N          | N                     | N                | N            | N               | N                | N                | N              | N                   | N                  | N                | N          | N            | N                      | N                   |          |            |             |              |             0 |           0 |               0 |                    0 | mysql_native_password | *E93577222CEFB0AD211863274B5845E1C8EA8968 | N                | N       |              |           0.000000 |
| %         | medio            | *A4B6157319038724E3560894F7F932C8886EBFCF | N           | N           | N           | N           | N           | N         | N           | N             | N            | N         | N          | N               | N          | N          | N            | N          | N                     | N                | N            | N               | N                | N                | N              | N                   | N                  | N                | N          | N            | N                      | N                   |          |            |             |              |             0 |           0 |               0 |                    0 | mysql_native_password | *A4B6157319038724E3560894F7F932C8886EBFCF | N                | N       |              |           0.000000 |
| %         | menor            | *61A641BC8207F7515ED44C765D55832199E924CD | N           | N           | N           | N           | N           | N         | N           | N             | N            | N         | N          | N               | N          | N          | N            | N          | N                     | N                | N            | N               | N                | N                | N              | N                   | N                  | N                | N          | N            | N                      | N                   |          |            |             |              |             0 |           0 |               0 |                    0 | mysql_native_password | *61A641BC8207F7515ED44C765D55832199E924CD | N                | N       |              |           0.000000 |
| localhost | profesor         | *0D40A28B2A23331F2FFFF7926E81C0CFBE489067 | Y           | N           | N           | N           | N           | N         | N           | N             | N            | N         | N          | N               | N          | N          | N            | N          | N                     | N                | N            | N               | N                | N                | N              | N                   | N                  | N                | N          | N            | N                      | N                   |          |            |             |              |             0 |           0 |               0 |                    0 | mysql_native_password | *0D40A28B2A23331F2FFFF7926E81C0CFBE489067 | N                | N       |              |           0.000000 |
| localhost | andres           | *0EC0AF67831A07B4DF60C818A6F515413F5B3795 | Y           | N           | N           | N           | N           | N         | N           | N             | N            | N         | N          | N               | N          | N          | N            | N          | N                     | N                | N            | N               | N                | N                | N              | N                   | N                  | N                | N          | N            | N                      | N                   |          |            |             |              |             0 |           0 |               0 |                    0 | mysql_native_password | *0EC0AF67831A07B4DF60C818A6F515413F5B3795 | N                | N       |              |           0.000000 |
| localhost | jose_1           | *06C0BF5B64ECE2F648B5F048A71903906BA08E5C | Y           | N           | N           | N           | N           | N         | N           | N             | N            | N         | N          | N               | N          | N          | N            | N          | N                     | N                | N            | N               | N                | N                | N              | N                   | N                  | N                | N          | N            | N                      | N                   |          |            |             |              |             0 |           0 |               0 |                    0 | mysql_native_password | *06C0BF5B64ECE2F648B5F048A71903906BA08E5C | N                | N       |              |           0.000000 |
+-----------+------------------+-------------------------------------------+-------------+-------------+-------------+-------------+-------------+-----------+-------------+---------------+--------------+-----------+------------+-----------------+------------+------------+--------------+------------+-----------------------+------------------+--------------+-----------------+------------------+------------------+----------------+---------------------+--------------------+------------------+------------+--------------+------------------------+---------------------+----------+------------+-------------+--------------+---------------+-------------+-----------------+----------------------+-----------------------+-------------------------------------------+------------------+---------+--------------+--------------------+
16 rows in set (0.001 sec)

MariaDB [db_profesor]> }
    ->
    ->
    -> ;
ERROR 1064 (42000): You have an error in your SQL syntax; check the manual that corresponds to your MariaDB server version for the right syntax to use near '}' at line 1
MariaDB [db_profesor]> SELECT User, Host FROM mysql.user;
+------------------+-----------+
| User             | Host      |
+------------------+-----------+
| maximo           | %         |
| medio            | %         |
| menor            | %         |
| prueba_admin     | %         |
| prueba_admin7    | %         |
| prueba_invitado  | %         |
| prueba_invitado7 | %         |
| prueba_user      | %         |
| prueba_user7     | %         |
| root             | 127.0.0.1 |
| root             | ::1       |
| andres           | localhost |
| jose_1           | localhost |
| pma              | localhost |
| profesor         | localhost |
| root             | localhost |
+------------------+-----------+
16 rows in set (0.001 sec)

MariaDB [db_profesor]> use db_profesor_pma
Database changed
MariaDB [db_profesor_pma]> SHOW TRIGGERS;
Empty set (0.002 sec)

MariaDB [db_profesor_pma]> SELECT * FROM PERSONAS;
+--------+---------+-----------+--------------+--------------+----------------+---------------------+------+
| cedula | nombre  | apellido  | direccion    | email        | telefono       | fecha_de_nacimiento | edad |
+--------+---------+-----------+--------------+--------------+----------------+---------------------+------+
| V1234  | ANA     | VASQUEZ   | SANTA FE     | AV@GMAIL.COM | +5821211234567 | 1960-08-15          |   66 |
| V5678  | YOLANDA | TORTOZA   | CATIA LA MAR | yt@gmail.com | 2123334455     | 1975-09-10          |   51 |
| V9012  | NELLY   | CONTRERAS | LA VEGA      | nc@gmail.com | 2124434930     | 1968-07-16          |   58 |
| V3456  | LIBIA   | COLS      | GUARENAS     | lc@gmail.com | 2123634106     | 1975-05-20          |   51 |
| V1234  | ANA     | VASQUEZ   | SANTA FE     | AV@GMAIL.COM | +5821211234567 | 1960-08-15          |   66 |
| V5678  | YOLANDA | TORTOZA   | CATIA LA MAR | yt@gmail.com | 2123334455     | 1975-09-10          |   51 |
| V9012  | NELLY   | CONTRERAS | LA VEGA      | nc@gmail.com | 2124434930     | 1968-07-16          |   58 |
| V3456  | LIBIA   | COLS      | GUARENAS     | lc@gmail.com | 2123634106     | 1975-05-20          |   51 |
| V1234  | ANA     | VASQUEZ   | SANTA FE     | AV@GMAIL.COM | +5821211234567 | 1960-08-15          |   66 |
| V5678  | YOLANDA | TORTOZA   | CATIA LA MAR | yt@gmail.com | 2123334455     | 1975-09-10          |   51 |
| V9012  | NELLY   | CONTRERAS | LA VEGA      | nc@gmail.com | 2124434930     | 1968-07-16          |   58 |
| V3456  | LIBIA   | COLS      | GUARENAS     | lc@gmail.com | 2123634106     | 1975-05-20          |   51 |
+--------+---------+-----------+--------------+--------------+----------------+---------------------+------+
12 rows in set (0.000 sec)

MariaDB [db_profesor_pma]> SELECT operacion from log;
+--------------------------------------------------------------------+
| operacion                                                          |
+--------------------------------------------------------------------+
| Se registr├│ el ingreso de un registro en la tabla personas         |
| Se registr├│ la eliminaci├│n de un registro en la tabla personas     |
| Se registr├│ la actualizaci├│n de un registro en la tabla personas   |
| Se registr├│ la actualizaci├│n de un registro en la tabla personas   |
| Se registr├│ la actualizaci├│n de un registro en la tabla personas   |
+--------------------------------------------------------------------+
5 rows in set (0.007 sec)

MariaDB [db_profesor_pma]>